{
  "analysis_type": "go",
  "query_input_count": 4,
  "query_mapped_count": 3,
  "query_unmapped_count": 1,
  "background_gene_count": 6,
  "tested_term_count": 1,
  "reported_term_count": 1,
  "omitted_term_count": 0,
  "terms": [{"term_id": "GO:0000001", "term_name": "Process A", "namespace": "go", "overlap_count": 2, "query_gene_count": 3, "background_term_count": 3, "background_gene_count": 6, "fold_enrichment": 1.3333333333, "p_value": 0.5, "adjusted_p_value": 0.5, "overlap_genes": ["g1", "g2"]}],
  "warnings": ["1 query identifiers were absent from the association universe"]
}
